<?xml version="1.0"?>
<!DOCTYPE gradeReport SYSTEM "gradeReport.dtd">
<gradeReport id="120851">
  <date>10-06-2008</date>
  <subject>Computer Science Fundamentals</subject>
  <examiner>prof.Litvinov</examiner>
  <gradeList>
    <gradeRecord id="1">
      <student>Ivanov</student>
      <grade>4</grade>
    </gradeRecord>
    <gradeRecord id="2">
      <student>Petrov</student>
      <grade>3</grade>
    </gradeRecord>
    <gradeRecord id="3">
      <student>Sidorov</student>
      <grade>5</grade>
    </gradeRecord>
  </gradeList>
</gradeReport>
